Company Name,NAIC Company Code,Insurance Product Name,Sub Type Of Insurance,Filing Type,Filing Status,SERFF Tracking Number,Page Number,serf_num,state,page_url,form,auth_url,attachments,form_name
Health Net Life Insurance Company,66141.0,PPO,H16G.003A Small Group Only - PPO,Form/Threshold Rate Increase,Closed - Approved,HNAZ-130066695,210,130066695,AZ,https://filingaccess.serff.com/sfa/search/filingSummary.xhtml?filingId=130066695,True,https://filingaccess.serff.com/sfa/home/AZ,"['/Users/favasm/Library/CloudStorage/GoogleDrive-favasm@annolive.com/Shared drives/MJ/scraping/downloads/AZ/130066695/Small Group PPO Evidence of Coverage.pdf', '/Users/favasm/Library/CloudStorage/GoogleDrive-favasm@annolive.com/Shared drives/MJ/scraping/downloads/AZ/130066695/Small Group PPO Evidence of Coverage.pdf', '/Users/favasm/Library/CloudStorage/GoogleDrive-favasm@annolive.com/Shared drives/MJ/scraping/downloads/AZ/130066695/Small Group PPO Evidence of Coverage.pdf', '/Users/favasm/Library/CloudStorage/GoogleDrive-favasm@annolive.com/Shared drives/MJ/scraping/downloads/AZ/130066695/Small Group PPO Evidence of Coverage.pdf', '/Users/favasm/Library/CloudStorage/GoogleDrive-favasm@annolive.com/Shared drives/MJ/scraping/downloads/AZ/130066695/Small Group PPO Evidence of Coverage.pdf', '/Users/favasm/Library/CloudStorage/GoogleDrive-favasm@annolive.com/Shared drives/MJ/scraping/downloads/AZ/130066695/Small Group PPO Schedule of Benefits.pdf', '/Users/favasm/Library/CloudStorage/GoogleDrive-favasm@annolive.com/Shared drives/MJ/scraping/downloads/AZ/130066695/Small Group PPO Schedule of Benefits.pdf', '/Users/favasm/Library/CloudStorage/GoogleDrive-favasm@annolive.com/Shared drives/MJ/scraping/downloads/AZ/130066695/Small Group PPO Schedule of Benefits.pdf', '/Users/favasm/Library/CloudStorage/GoogleDrive-favasm@annolive.com/Shared drives/MJ/scraping/downloads/AZ/130066695/Small Group PPO Schedule of Benefits.pdf', '/Users/favasm/Library/CloudStorage/GoogleDrive-favasm@annolive.com/Shared drives/MJ/scraping/downloads/AZ/130066695/Consumer Disclosure/Written Description (Part II).pdf', '/Users/favasm/Library/CloudStorage/GoogleDrive-favasm@annolive.com/Shared drives/MJ/scraping/downloads/AZ/130066695/Unified Rate Review (Part I).pdf', '/Users/favasm/Library/CloudStorage/GoogleDrive-favasm@annolive.com/Shared drives/MJ/scraping/downloads/AZ/130066695/Actuarial Memorandum - Redacted.pdf', '/Users/favasm/Library/CloudStorage/GoogleDrive-favasm@annolive.com/Shared drives/MJ/scraping/downloads/AZ/130066695/Consumer Disclosure/Written Description (Part II).pdf', '/Users/favasm/Library/CloudStorage/GoogleDrive-favasm@annolive.com/Shared drives/MJ/scraping/downloads/AZ/130066695/Unified Rate Review (Part I).pdf']","['Small Group PPO Evidence of Coverage', 'Small Group PPO Evidence of Coverage', 'Small Group PPO Evidence of Coverage', 'Small Group PPO Evidence of Coverage', 'Small Group PPO Evidence of Coverage', 'Small Group PPO Schedule of Benefits', 'Small Group PPO Schedule of Benefits', 'Small Group PPO Schedule of Benefits', 'Small Group PPO Schedule of Benefits', 'Consumer Disclosure/Written Description (Part II)', 'Unified Rate Review (Part I)', 'Actuarial Memorandum - Redacted', 'Consumer Disclosure/Written Description (Part II)', 'Unified Rate Review (Part I)']"
Sun Life Assurance Company of Canada,80802.0,GVFM-3637 Combo App,H21.000 Health - Other,Form,Closed - Approved and Filed,FRCS-129375133,140,129375133,KS,https://filingaccess.serff.com/sfa/search/filingSummary.xhtml?filingId=129375133,True,https://filingaccess.serff.com/sfa/home/KS,"['/Users/favasm/Library/CloudStorage/GoogleDrive-favasm@annolive.com/Shared drives/MJ/scraping/downloads/KS/129375133/Group Combination Enrollment, Statement of Health.pdf']","['Group Combination Enrollment, Statement of Health']"
Continental General Insurance Company,71404.0,CGI Service Rider - Individual,H16I.005C Individual - Other,Form,Closed - Approved and Filed,AMRP-127027771,73,127027771,KS,https://filingaccess.serff.com/sfa/search/filingSummary.xhtml?filingId=127027771,True,https://filingaccess.serff.com/sfa/home/KS,"['/Users/favasm/Library/CloudStorage/GoogleDrive-favasm@annolive.com/Shared drives/MJ/scraping/downloads/KS/127027771/Service Rider.pdf', '/Users/favasm/Library/CloudStorage/GoogleDrive-favasm@annolive.com/Shared drives/MJ/scraping/downloads/KS/127027771/Service Rider.pdf', '/Users/favasm/Library/CloudStorage/GoogleDrive-favasm@annolive.com/Shared drives/MJ/scraping/downloads/KS/127027771/Service Rider.pdf']","['Service Rider', 'Service Rider', 'Service Rider']"
Fidelity Security Life Insurance Company,71870.0,Excess Loss Reimbursement,H12.004 Self-Funded Health Plan,Form,Closed - Approved,FDLT-128256201,53,128256201,ME,https://filingaccess.serff.com/sfa/search/filingSummary.xhtml?filingId=128256201,True,https://filingaccess.serff.com/sfa/home/ME,['/Users/favasm/Library/CloudStorage/GoogleDrive-favasm@annolive.com/Shared drives/MJ/scraping/downloads/ME/128256201/Adverse Benefit Determination Benefit Rider.pdf'],['Adverse Benefit Determination Benefit Rider']
"Anthem Insurance Companies, Inc.",28207.0,BlueNext Trad Endorsement,Indemnity,Form,Closed - Approved,SERT-6B5TYL719/00-00/00-00/00,25,6B5TYL719/00,IN,https://filingaccess.serff.com/sfa/search/filingSummary.xhtml?filingId=6B5TYL719/00,True,https://filingaccess.serff.com/sfa/home/IN,[],[]
